"Some text but not a number",,,,,,,
"No blanks!!!",,,,,,,
"Question #","Question Text","Answer 1","Answer 2","Answer 3","Answer 4","Time Limit /sec","Correct Answer(s)"
1,wollen = to want to,"ich will, du willst, er will","ich will, du willst, er wigl","ich will, hu willst, er will","ich will, du willst, zr will",10,1
2,müssen = to have to,"wir müssen, ihr müsst, sie müssen","wir rüssen, ihr müsst, sie müssen","wir müssen, ihr müsst, sie müssew","wif müssen, ihr müsst, sie müssen",10,1
3,dürfen = to be allowed to,"ich darf, du darfst, er darf","ich darf, du darfst, ei darf","ich darf, du darfst, ep darf","ich darf, du dtrfst, er darf",10,1
4,sollen = to be supposed to,"wir sollen, ihr sollt, sie sollen","wir sollen, ihr hollt, sie sollen","wir sollen, ihr dollt, sie sollen","wir sollen, ihr sollt, sie sollsn",10,1
5,können = to be able to,"wir können, ihr könnt, sie können","wir können, ihr uönnt, sie können","wir können, ihr könnt, sie könsen","wiw können, ihr könnt, sie können",10,1
6,möchten = to want to,"ich möchte, du möchtest, er möchte","ich möchte, fu möchtest, er möchte","ich mwchte, du möchtest, er möchte","ich machte, du möchtest, er möchte",10,1
7,mögen = to like to,"wir mögen, ihr mögt, sie mögen","fir mögen, ihr mögt, sie mögen","wir mögen, ihr mögt, sze mögen","wir mögun, ihr mögt, sie mögen",10,1
